{
  "schema_version": "1.1",
  "kind": "environment",
  "environment_id": "kit-linux-model-snapshot",
  "image_digest": "sha256:2222222222222222222222222222222222222222222222222222222222222222",
  "architecture": "x86_64",
  "model": {
    "provider": "fixture-provider",
    "name": "fixture-model",
    "snapshot": "2026-07-21",
    "reasoning_effort": "medium",
    "model_digest": "sha256:3333333333333333333333333333333333333333333333333333333333333333",
    "settings_digest": "sha256:4444444444444444444444444444444444444444444444444444444444444444",
    "provider_capability_digest": "sha256:5555555555555555555555555555555555555555555555555555555555555555"
  },
  "components": {
    "prompt_digest": "sha256:4444444444444444444444444444444444444444444444444444444444444444",
    "tools_digest": "sha256:5555555555555555555555555555555555555555555555555555555555555555",
    "router_digest": "sha256:6666666666666666666666666666666666666666666666666666666666666666",
    "retry_policy_digest": "sha256:7777777777777777777777777777777777777777777777777777777777777777",
    "verifier_digest": "sha256:8888888888888888888888888888888888888888888888888888888888888888"
  }
}
